{
  "schema_version": "intake-domain-snapshot.v2",
  "snapshot_id": "SNAPSHOT_P4_USER_1",
  "tenant_surrogate": "tenant-synthetic",
  "case_id": "CASE_P4_SYNTHETIC_1",
  "room_type": "INTAKE",
  "room_epoch": 1,
  "thread_id": "grt.v1.018f6b7ec30a7430982fffc520c8195c",
  "actor_scope_hash": "52f01901287fe5e5465ddcd7d7baf9074aa77e3d88a64da747bf1f530916a5d2",
  "agent_session_id": "AGENT_SESSION_P4_USER_1",
  "domain_revision": 4,
  "room_revision": 2,
  "projection_revision": 4,
  "visibility": "PRIVATE",
  "source_refs": ["MESSAGE_P4_USER_1"],
  "initial_case_facts": {
    "initiator_role": "USER",
    "form_description": "Synthetic order arrived damaged."
  },
  "shareable_projection": {"intake_status": "OPEN"},
  "own_messages": [
    {
      "message_id": "MESSAGE_P4_USER_1",
      "role": "HUMAN",
      "audience": "USER",
      "sequence": 1,
      "text": "Synthetic order arrived damaged.",
      "source_hash": "1111111111111111111111111111111111111111111111111111111111111111"
    }
  ],
  "current_dossier": {"schema_version": "intake-dossier.v2"},
  "created_at": "2026-07-20T08:01:00Z",
  "snapshot_hash": "7deb1aa13efc125244aa0e122b6e02dc4343f97afc0423c94a00308b217fea0d"
}
